{
  "id": "postmark",
  "name": "Postmark",
  "category": "email",
  "aliases": [],
  "packages": {
    "npm": "postmark",
    "pypi": null,
    "go": null,
    "gem": null,
    "maven": null
  },
  "envPrefixes": [
    "POSTMARK_API_TOKEN"
  ],
  "hosts": [
    "api.postmarkapp.com"
  ],
  "statusFeed": null,
  "substrate": [
    {
      "value": "aws",
      "confidence": "verified",
      "evidence": [
        {
          "url": "https://ip-ranges.amazonaws.com/ip-ranges.json",
          "note": "api.postmarkapp.com resolves to 3.136.210.2, published in AWS ip-ranges.json (region us-east-2). Checked via scripts/verify-substrates.ts.",
          "retrievedAt": "2026-09-19"
        }
      ]
    }
  ],
  "sla": {
    "value": 0.999,
    "sourceUrl": null,
    "retrievedAt": null
  },
  "alternatives": []
}
