{
  "id": "amazon-bedrock",
  "name": "Amazon Bedrock",
  "category": "ai",
  "aliases": [],
  "packages": {
    "npm": "@aws-sdk/client-bedrock-runtime",
    "pypi": null,
    "go": null,
    "gem": null,
    "maven": null
  },
  "envPrefixes": [],
  "hosts": [
    "bedrock-runtime.us-east-1.amazonaws.com"
  ],
  "statusFeed": null,
  "substrate": [
    {
      "value": "aws",
      "confidence": "verified",
      "evidence": [
        {
          "url": "https://ip-ranges.amazonaws.com/ip-ranges.json",
          "note": "bedrock-runtime.us-east-1.amazonaws.com resolves to 13.217.253.194, published in AWS ip-ranges.json (region us-east-1); Amazon Bedrock is a first-party AWS service. Checked via scripts/verify-substrates.ts.",
          "retrievedAt": "2026-09-19"
        }
      ]
    }
  ],
  "sla": {
    "value": 0.999,
    "sourceUrl": null,
    "retrievedAt": null
  },
  "alternatives": []
}
