{
  "id": "mongodb-atlas",
  "name": "MongoDB Atlas",
  "category": "data",
  "aliases": [],
  "packages": {
    "npm": "mongodb",
    "pypi": null,
    "go": null,
    "gem": null,
    "maven": null
  },
  "envPrefixes": [
    "MONGODB_URI"
  ],
  "hosts": [],
  "statusFeed": null,
  "substrate": [
    {
      "value": "aws",
      "confidence": "unknown",
      "evidence": []
    }
  ],
  "sla": {
    "value": 0.999,
    "sourceUrl": null,
    "retrievedAt": null
  },
  "alternatives": []
}
