{
  "id": "openai",
  "name": "OpenAI",
  "category": "ai",
  "aliases": [],
  "packages": {
    "npm": "openai",
    "pypi": null,
    "go": null,
    "gem": null,
    "maven": null
  },
  "envPrefixes": [
    "OPENAI_API_KEY"
  ],
  "hosts": [
    "api.openai.com"
  ],
  "statusFeed": {
    "kind": "statuspage",
    "url": "https://status.openai.com/api/v2/status.json"
  },
  "substrate": [
    {
      "value": "azure",
      "confidence": "unknown",
      "evidence": []
    }
  ],
  "sla": {
    "value": 0.999,
    "sourceUrl": null,
    "retrievedAt": null
  },
  "alternatives": []
}
