{
  "id": "next-auth",
  "name": "NextAuth.js",
  "category": "auth",
  "aliases": [],
  "packages": {
    "npm": "next-auth",
    "pypi": null,
    "go": null,
    "gem": null,
    "maven": null
  },
  "envPrefixes": [
    "NEXTAUTH_SECRET"
  ],
  "hosts": [],
  "statusFeed": null,
  "substrate": [
    {
      "value": "self",
      "confidence": "unknown",
      "evidence": []
    }
  ],
  "sla": {
    "value": 0.999,
    "sourceUrl": null,
    "retrievedAt": null
  },
  "alternatives": []
}
